AC_NO,AC_TYPE,NR_REQUEST_DATE,CLOSE_DATE,MALFUNCTION,CORRECTIVE_ACTION
HL7587,330,2024-11-28 0:00:00,2024-11-28 6:30:12,APU AUTO SHUTDOWN AFT LANDING,"MSG:FUEL SPLY/FCU(59KF19)FLOW DIVIDER ASSY. ACCORDING TO TSM TASK 49-62-00-810-838-A.FUEL BLEEDING AND APU OPS CHECKED, NML. IAW AMM TASK 49-00-00-710-801-A"
HL7553,330,2024-11-06 0:00:00,2024-11-07 8:42:07,APU FAULT DURING START ATTEMPT. AS PER ECAM MATER SW SELECTED OFF.,PERFORMED APU REATART THEN OPERATION TEST NML PER AMM 49-00-00-710-801-A (NO  MAINT MSG)
HL7702,330,2024-11-03 0:00:00,2024-11-03 1:23:28,APU FAULT AUTO SHUT DOWN MSG DISPLAYED,"NO MAINT MSG, AFTER RESETING MASTER SW, START AND OP CHKD NML PER AMM TASK 49-00-00-710-801-A"
HL7710,330,2024-11-03 0:00:00,2024-11-03 7:08:24,APU FAULT MSG DISPLAYED WHEN APPROACHING GATE.,"MAINT MSG:495152,492316 NOT CONFIRMED, IAW TSM 49-62-00-810-843-A/49-23-00-810-802-A WIRING CHKED NML FROM ECB TO SCV(59KH18), LCOT SNSR(59KE2) BUT LCOT SNSR RESISTANCE CHK RESULT &quot;OPEN&quot;(NML:55-67&Omega;) AND FAULT FOUND LCOT SNSR ALUMEL NUT MISSING THEN INSTALLED LCOT SNSR ALUMEL NUT AND OP TEST NML PER AMM 49-23-16-400-801-A"
HL7524,330,2024-10-25 0:00:00,2024-10-26 2:26:08,LOW FUEL PRESSURE MSG MEMORIZED ON PFR,"MAINT MSG 282000. NOT CONFIRMED. IAW TSM 49-00-00-810-816-A, APU FUEL SUPPLY TEST AND APU OPERATIONAL TEST NORMAL PER AMM 49-00-00-710-801-A."
HL7587,330,2024-10-19 0:00:00,2024-10-20 0:31:12,APU OIL PUMP LUBRICATION OIL FILTER DELTA P INDICATOR POP OUT,"NO MAINT MSG, REPLACED SCAVENGE OIL FILTER AND THEN LEAK CH'KED NML PER AMM TASK 49-91-41-960-801-A"
HL7720,330,2024-10-18 0:00:00,2024-10-19 5:06:52,APU SURGE CTL V/V SLEEVE TORN,"REPLACED DUCT SLEEVE AND AIR LEAK CHECKED NORMAL PER AMM TASK 49-51-52-400-801-A (PME CONTROL NO : MI00022558, MI00023868)"
HL8026,330,2024-10-10 0:00:00,2024-10-11 4:05:27,WIRING CHK DUE FOR &quot;APU FAULT&quot; MSG,"MAINT MSG  &quot; LUBE PMP FILTER + GEN SCAV FILTER (5100KT9)&quot; , NOT CONFIRMED. WIRING CHECKED NORMAL FROM APU P1 CONNECTOR TO Delta P Switch - Generator Scavenge (59KT37), Delta P Switch - Lubrication (59KT36). PER AWM 49-15-01, 49-61-03."
HL7720,330,2024-10-09 0:00:00,2024-10-11 1:30:00,APU FAULT AUTO SHUT DOWN.,"MAINT MSG NO 494138, ACCORDING TO TSM 49-00-00-810-881-A, REPLACED IGN PLUGS, EXCITER, LEAD LINES AND THEN OP' TEST &amp; BITE TEST NML PER AMM TASK 49-41-41-400-801-A, 49-41-38-400-801-A, 49-41-43-400-801-A "
HL7720,330,2024-10-08 0:00:00,2024-10-09 0:04:43,"AFTER LANDING, DURING APU START APU FAULT ECAM MESSAGE ON",PERFORMED APU REATART THEN OPERATION TEST NML PER AMM 49-00-00-710-801-A (NO MAINT MSG)
HL8026,330,2024-10-08 0:00:00,2024-10-10 22:33:34,APU FAULT,"NO MAINT MSG ACCORDING TO TSM 49-62-00-810-916-A REPLACED OIL FILTER AND SCAVENGE OIL FILTER ,CHIP DETECTOR INSPECTION NML AND THEN APU OP TEST OK PER AMM 49-91-41-960-801-A"
HL8027,330,2024-09-30 0:00:00,2024-10-15 23:30:05,[PREDICTIVE] APU LOAD CONTROL VALVE ABNORMAL OPERATION," NO MAINT MSG, ACCORDING TO MCE REQUEST, REPLACED APU BLEED VALVE AND CHECKED NML PER AMM TASK NO 49-51-51-400-801-A"
HL7524,330,2024-09-30 0:00:00,2024-10-01 1:18:16,APU ACCESSARY COOLING FAN INLET DUCT TORN," NO MAINT MSG,REPLACED WITH NEW INLET DUCT AND AIR LEAK CHK NORMAL PER AMM TASK 49-52-51-400-801-A."
HL7720,330,2024-09-26 0:00:00,2024-09-27 5:00:32,APU CONSIDER INOP,RELATION TO LOG PAGE 149838 ITEM 'A'  PERFORMED  REPLACED APU GEN AND APU OP' NML PER AMM TASK 49-00-00-860-801-A
HL7586,330,2024-09-20 0:00:00,2024-09-21 11:32:00,"AFT LDG AND APU START,  APU INOP AND SHUT DOWN APU","MAINT MSG NO: 282000, ACCORDING TO TSM TASK 49-62-00- 810-838-A, APU FUEL LINE BLEEDING AND THEN APU OP' TEST  NML PER AMM TASK 49-00-00-710-801-A, 28-22-00-870-801-A"
HL7720,330,2024-09-17 0:00:00,2024-09-17 2:16:52,APU SURGE DUCT INSULATION BLANKET DAMAGED,"RE-TORQUED SURGE CONTROL VALVE COUPLING AND REPLACED SURGE AIR DUCT UPR,LWR INSULATION BLANKET AND THEN LEAK CHECKED NORMAL PER AMM TASK 49-51-52-400-801-A  (PME NO:MI00011690,MI00017828)"
HL8276,330,2024-09-13 0:00:00,2024-10-15 16:15:00,(TW ITEM_311)APU ZABARA HOSE HAS WEAR DAMAGED(EXHAUST BELLOWS),"REPLACED APU EXHAUST MUFFLER BELLOWS PER AMM TASK 49-81-45-000-801-A &amp; AMM TASK 49-81-45-400-801-A,PME/MP00023999,MP00029242"
HL7585,330,2024-09-13 0:00:00,2024-09-14 1:00:08,APU SURGE CTL V/V SLEEVE TORN,NO MSG.REPLACED DUCT SLEEVE AND AIR LEAK CHECK NML PER AMM TASK 49-51-52-400-801-A
HL8025,330,2024-09-10 0:00:00,2024-09-10 7:13:15,APU SURGE CONTROL VALVE SLEEVE TORN,REPLACED SLEEVE AND THEN APU' OP' LEAK CHK NML PER AMM TASK 49-51-52-400-801-A
HL8276,330,2024-09-10 0:00:00,2024-10-12 15:24:56,"(TW ITEM_312)APU SURGE CONTROL VALVE, DRAIN HOSE TORN.","REPLACED APU SURGE CONTROL VALVE, DRAIN HOSE PER AMM TASK 49-51-52-400-801-A "
HL8025,330,2024-09-01 0:00:00,2024-09-10 3:04:30,[PREDICTIVE] APU OIL TEMP TOO HIGH,"NO MAINT MSG, RESULT OF T/S OIL COOLER CONTAMINATED, REPLACED OIL COOLER ASSY AND THEN APU OP' AND LEAK CHK NML PER AMM TASK 49-91-44-400-801-A"
HL8228,330,2024-09-01 0:00:00,2024-09-01 15:12:08,IGN PLUG(59KA31) / IGN EXCITER(59KA10) MSG ON PFR,"MAINT MSG 494138. ACCORDIND TO TSM 49-41-00-810-813-A.  REPLACED APU IGN EXCITER &amp; UPR IGN PLUG THEN TEST NORMAL PER AMM TASK 49-41-38-400-801-A, 49-41-41-400-801-A"
HL8026,330,2024-08-31 0:00:00,2024-08-31 9:19:07,APU AUTO SHUT DOWN APPROACHING THE GATE ON ARRIVAL,"NO MAINT MSG, PERFORMED BLEEDING THE APU FUEL FEED LINE AND THEN OPER' TEST OK PER AMM TASK 28-22-00-870-801-A, AMMTASK 49-00-00-860-801-A"
HL8026,330,2024-08-31 0:00:00,2024-09-01 7:07:02,REPEATED APU IGN/EXCITER MSG RECHECK DUE,"MAINT MSG NO 494138, ACCORDING TO TSM 49-00-00-810-881-A, REPLACED IGN PLUGS, EXCITER, LEAD LINES AND THEN OP' TEST &amp; BITE TEST NML PER AMM TASK 49-41-41-400-801-A, 49-41-38-400-801-A, 49-41-43-400-801-A (PME CONT NO. MI00005785, MI00015543)"
HL7584,330,2024-08-30 0:00:00,2024-08-30 14:30:00,APU BLEED VALVE WIRING CHECK DUE,"APU BLEED VALVE RESISTANCE CHECKED NORMAL (MEASURE : 63.7 OHM, NORMAL : 20-75 OHM) AND WIRING CHECKED NORMAL FROM APU ECB TO APU BLEED VALVE PER TSM 49-00-00-810-808-A, 49-62-00-810-841-A, AWM 49-15-01 (PME : MI00010667)"
HL7584,330,2024-08-27 0:00:00,2024-09-03 2:53:23,APU AUTO SHUTDOWN,"MAINT MSG:282000,ACCORDING TO TSM 49-62-00-810-836-A, REPLACED FUEL CONTROL UNIT AND THEN APU OP' AND LEAK CHK NML PER AMM TASK 49-32-51-400-801-A"
HL8026,330,2024-08-23 0:00:00,2024-08-24 2:21:03,APU SURGE CONTROL VALVE SLEEVE TORN,REPLACED APU SURGE CONTROL VALVE OUTLET DUCT SLEEVE PER AMM TASK 49-51-52-400-801-A
HL7710,330,2024-08-20 0:00:00,2024-08-20 4:30:00,APU LUBRICATION  OIL FILTER &amp; MCD INSP  DUE,"ACCOMPLISHED PER AMM TASK 49-91-41-960-801-A, 49-91-11-200-801-A (INSP' RESULT : NML)"
HL8002,330,2024-08-08 0:00:00,2024-08-08 6:15:23,BAD SMELL IN THE CABIN WHEN APU RUNNING (ON THE GRD),"NO MAINT MSG, NO FOUND LEAKAGE ON APU EXTERNAL, BUT FOUND CONTAMINATION AT INSIDE OF INTAKE DUCT, SO CLEANED INTAKE DUCT AND THEN CONDITION CH'KED NML PER TSM TASK 49-00-00-810-831-A"
HL8228,330,2024-08-07 0:00:00,2024-08-13 14:03:28,APU COOLING V/V BODY FLAPPER NOT MOVE SMOOTHLY.,REPLACED APU COMPARTMENT COOLING V/V PER AMM TASK 49-52-52-000-801-A &amp; AMM TASK 49-52-52-400-801-A.
HL8228,330,2024-08-06 0:00:00,2024-08-13 15:11:35,(DM:225838)APU EXHAUST MUFFLER BELLOWS UPR AREA TORN,"REPLACED APU EXHAUST MUFFLER BELLOWS PER AMM TASK 49-81-45-000-801-A &amp; AMM TASK 49-81-45-400-801-A/MP00023999,MP00025568"
HL8228,330,2024-08-06 0:00:00,2024-08-13 14:07:45,(DM:200872)APU EXHAUST MUFFLER DRAIN HOSE DAMAGED,REPLACED APU EXHAUST MUFFLER DRAIN HOSE PER AMM TASK 49-81-45-000-801-A &amp;49-81-45-400-801-A.
HL8228,330,2024-08-06 0:00:00,2024-08-13 15:49:45,(TW_ITEM 143)(DM:225837)APU R/H SIDE IGV ACT' DRAIN LINE PROTECTING RUBBER HOSE HAS DAMAGED,REPLACED DRAIN LINE HOSE(TUBE) PER AMM TASK 49-23-51-000-801-A &amp; AMM TASK 49-23-51-400-801-A.
HL8001,330,2024-08-05 0:00:00,2024-08-06 5:35:07,APU OIL TEMP HIGH. (105 'C),"NO MAINT MSG. ACCORDING TO TSM TASK 49-62-00-810-815-A, REPLACED APU OIL COOLER ASSY AND THEN APU OP' &amp; LEAK CH'KED NML PER AMM 49-91-44-400-801-A."
HL8228,330,2024-08-03 0:00:00,2024-08-28 3:02:55,APU AUTO SHUT DOWN(RPM 82% ABOVE NOT INCREASE),"LOG/130637/DC  1.PERFORMED APU OP' AND OCCURRED APU AUTO SHUT DOWN DURING THE RPM 82% TSM TASK49-62-00-810-836-A PARA3-A-(4)/2024.08.04/&#44608;&#48124;&#52384;2.PERFORMED TROUBLESHOOTING AFT APU FUEL FEED PUMP &amp; FWD APU FUEL FEED PUMP AND APU START AND NO ACCELERATION AT RPM 85% PER TSM TASK49-62-00-810-836-A PARA3-A-(5)/2024.08.23/&#51060;&#51116;&#50676;3.REMOVED APU AIR INTAKE DUCT &amp; APU BLEED ELBOW AIR DUCT PER AMM TASK 49-11-11-000-801-A PARA 1~4.A.(3)/2024.08.27/&#44285;&#48393;&#44428;,4.CONNECTED OF THE ELECTRICAL CABLES AND APU FIRE &amp; OVERHEAT DETECTION LOOOPS OP CHECKED NML  PER AMM TASK 49-11-11-400-801-A ITEM 4-E-(3)~(5),26-13-00-710-801-A (PME:MP00027668, MP00025206)/2024.08.28/&#47448;&#49849;&#47785;/&#44608;&#53468;&#51068;5.REPLACED APU,INSTALLED  DUCTS , APU DEPRESERVATION, OP' LEAK  CH'KED NORMAL PER AMM 49-11-11-000-801-A, 49-11-11-400-801-A,49-00-00-550-803-A, PME/MP00024362,MP00025086,MP00025568,MP00026978,MP00015447"
HL7585,330,2024-08-01 0:00:00,2024-08-02 1:40:38,[39 SAVE] [PREDICTIVE MAINT]REPEATED APU IGNITION MESSAGE RE-CHK DUE.,"MAINT MSG NO 494138, ACCORDING TO TSM 49-00-00-810-881-A, REPLACED IGN-EXCITER AND THEN APU BITE &amp; OP' TEST NML PER AMM TASK 49-41-38-400-801-A"
HL7586,330,2024-07-31 0:00:00,2024-08-01 1:48:45,REPEATED APU CHECK OIL QUANTITY MSG,APU OIL QTY CHK AND OIL LEAK INSPECTION NML PER AMM 49-00-00-790-801-A
HL7587,330,2024-07-28 0:00:00,2024-07-28 18:56:20,APU AUTO SHUT DOWN (NOT START) ON GRD,"MAINT MSG 494138.IAW TSM TASK 49-00-00-810-881-A,REPLACED APU IGN EXCITER AND THEN APU OP' TEST &amp; BITE TEST NML PER AMM TASK 49-41-38-400-801-A"
HL7702,330,2024-07-27 0:00:00,2024-07-27 7:10:10,WIRING CHK DUE CONCERNING &ldquo;AFTER SHUT DOWN ECAM AIR APU BLEED FAULT&rdquo; .,"MAINT MSG:495151, CONFIRMED. IAW TSM 49-62-00-810-841-A WIRING CONTINUTY &amp; INSULATION CHKED NML FROM ECB TO APU BLEED V/V(59KH7) PER AWM 49-15-01"
HL7586,330,2024-07-27 0:00:00,2024-07-27 5:43:37,[NON FDE] 'EGT TCPLE RAKES (59KV34)X(59KV35)' MSG MEMORIZED ON PFR,"MAINT MSG : 497215, NOT CONFIRMED ,IAW TSM 49-00-00-810-803-A, WIRING CHK&rsquo;D NML (EGT PROBE NO1: 71.8 &Omega;, NO2: 72.8 &Omega;/ NML: 60-75 &Omega;) AND THEN APU BITE TESTED NML PER AMM 49-00-00-710-052-A"
HL7584,330,2024-07-26 0:00:00,2024-07-27 0:25:50,APU AUTO SHUTDOWN,"MAINT MSG NO282000, ACCORDING TO TSM 49-62-00-810-836-A, APU FUEL LINE BLEEDING AND THEN APU OP' TEST NML PER AMM TASK 49-00-00-710-801-A"
HL7540,330,2024-07-24 0:00:00,2024-07-23 23:00:12,REPEATED APU IGNITION MESSAGE RELATED WIRING CHECK DUE,"MAINT MSG:494138, NOT CONFIRMED, ACCORDING TSM 49-00-00-810-881-A BETWEEN APU ECB(59KD) AND IGNITION EXCITER(59KA10), MID CONNECTORS (5129VC, 5127VC) WIRING CONTINUITY AND INSULATION CHK NORMAL  WITH WIRE BUNDLE SHAKING PER AWM 49-15-01"
HL8027,330,2024-07-24 0:00:00,2024-08-04 5:23:17,[PREDICTIVE] APU LOAD CONTROL VALVE (59KH7) ABNORMAL OPERATION,"NO MAINT MSG,APU LOAD CONT V/V CONNECTOR P12 TO P7 AND BLD CHK V/V INSPECTION NML AND APU BLD V/V FILTER CHG'D AND THEN APU OPERATION LEAK CHK'D NML PER AMM TASK 36-12-51-200-801-A,49-51-51-960-801-A.(PME:MI00016533,MI00018809)"
HL8002,330,2024-07-19 0:00:00,2024-07-19 4:50:10,WIRING CHECK DUE FOR &quot;APU LOAD COMP' INLET TEMP FLUCTUATE&quot;,MAINT MSG:492315 &amp; NOT CONFIRMED IAW TSM 49-23-0-810-801-A APU ECB TO LOAD COMP INLET TEMP SNSR (59KE1) WIRING CHK'D NML PER AWM 49-15-01 49-61-03
HL7710,330,2024-07-19 0:00:00,2024-07-20 13:47:52,[39 SAVE] APU FAULT,"MAINT MSG NO 282000, ACCORDING TO TSM 49-62-00-810-836-A, REPLACED APU FCU AND APU O'P CH'K NML PER AMM 49-32-51-400-801-A"
HL8027,330,2024-07-17 0:00:00,2024-07-17 6:52:08,APU COOLING FAN ASSY' BODY PUNCTURE (BY CORRSION)," NO MAINT MSG, REPLACED COOLING FAN ASSY AND CHECKED NML PER AMM NO 49-52-51-400-801-A (CANNI FROM SPARE APU P/N:3800454,S/N:P1695, AUTH 17575)(PME NO: MI00022558,MI00016621)"
HL7586,330,2024-07-17 0:00:00,2024-07-17 7:10:39,AFTER LANDING APU FAULT(2 ATTEMPT NOT SUCCESSFUL),"MAINT MSG NO: 282000, I/A/W TSM 49-62-00-810-838-A, APU FUEL LINE BLEEDING AND APU OP' TEST NML. PER AMM 49-00-00-710-801-A, 28-22-00-870-801-A"
HL8027,330,2024-07-16 0:00:00,2024-07-17 7:03:50,APU IGV ACTUATOR DRAIN HOSE TORN,"NO MAINT MSG, REPLACED APU IGV HOSE AND CHECKED NML PER AMM TASK NO 49-23-51-400-801-A (PME NO  MI00022558)"
HL7540,330,2024-07-16 0:00:00,2024-08-05 3:36:59,[39 SAVE] [PREDICTIVE] REPEATED APU IGNITION MESSAGE,MAINT MSG NO 494138. ACCORDING TO TSM TASK 49-00-00-810-881-A. REPLACED IGN EXICTER AND THEN  APU BITE TEST NML PER AMM TASK 49-41-38-400-801-A.
HL8027,330,2024-07-16 0:00:00,2024-07-17 7:10:30,APU COOLING DUCT TORN(14CM),"NO MAINT MSG, REPLACED DUCT AND CHECKED NML PER AMM TASK 49-52-51-400-801-A (PME NO  MI00022558) (CANNI FROM SPARE APU P/N:3800454-6, S/N:P-1695, AUTH NO 17573)"
HL8027,330,2024-07-16 0:00:00,2024-07-17 7:00:49,APU SURGE CONTOL VALVE DRAIN HOSE TORN,"NO MAINT MSG, REPLACED SVC DRAIN HOSE AND CHECKED NML PER AMM TASK NO 49-51-52-400-801-A (PME NO MI00022558)"
HL7584,330,2024-07-14 0:00:00,2024-07-14 6:11:14,APU IGV SYSTEM WIRING CHECK DUE FOR &quot;ECAM AIR APU BLEED FAULT DISPLAYED AFTER ENG SHUT DOWN&quot;,"MAINT' MSG: 492351 &amp; FAULT CONFIRMED. IAW TSM TASK49-00-00-810-810-A, APU BITE TESTED &quot;	IGV ACTR (59KE21)&quot;MSG DISPLAYED. SYSTEM WIRING CHECKED NORMAL BETWEEN APU ECB AND APU IGV ACT(59KE21). BUT, APU IGV ACT' TM RESISTANCE SOMETIMES  FLUCTUATED(MEASURE 50~5, LIMIT: 15~25&#8486;) PER AWM49-51-03/49-15-01 &amp; AMM TASK49-00-00-740-801-A&lt;PME CONT' No. MI00020607&gt;"
HL8026,330,2024-07-14 0:00:00,2024-07-14 6:35:31,APU OIL COOLER INLET DUCT TORN (12cm),REPLACED APU OIL COOLER INLET DUCT AND OPER CHK NML PER AMM 49-52-51-400-801-A (CANNI FORM SPARE APU PN: 3800454-6 SN: P1717 AUTH NO : 17555)
HL7701,330,2024-07-14 0:00:00,2024-07-14 6:59:53,LOW OIL TEMP SNSR(59KT9) MSG MEMORIZED ON PFR,"MAINT MSG:499112. ACCORDING TO TSM 49-00-00-810-801-A, CHECKED RESISTANCE RESULT 119.6OHMS. SO REPLACED LOW OIL TEMP SNSR. AND THEN APU GRD SCANNING &amp; LEAK CHECK NORMAL PER AMM TASK 49-91-12-400-801"
HL7584,330,2024-07-13 0:00:00,2024-07-14 3:55:30,ECAM AIR APU BLEED FAULT DISPLAYED AFTER ENG SHUT DOWN,"MAINT MSG NO 492351, ACCORDING TO TSM 49-00-00-810-810-A, REPLACED APU IGV ACTUATOR AND THEN APU OP' &amp; LEAK CHK NML PER AMM TASK 49-23-51-400-801-A"
HL7584,330,2024-07-12 0:00:00,2024-07-12 19:38:29,AIR APU BLEED FAULT AFTER ENG SHUTDOWN ON THE GROUND APU COOLING IS NOT ADEQUATE,NO MAINT MSG ACCORDING TO TSM 36-12-00-810-805-A DO THE BITE TEST OF BMC 1 NORMAL PER AMM TASK 36-11-00-740-803 &amp; 49-00-00-860-801
HL8002,330,2024-07-12 0:00:00,2024-07-19 7:06:24,[PREDICTIVE] APU LCIT Fluctuated,REPLACED APU LCIT AND APU OP' AND GRD SCANNING TEST NML PER AMM 49-23-15-400-801-A
HL7540,330,2024-07-12 0:00:00,2024-07-13 10:07:37,[Predictive] REPEATED APU IGNITION MESSAGE,"MAINT MSG: 494138, NOT CONFIRMED. REF TO TSM 49-00-00-810-881-A, REPLACED ECB(59KD) FOR PREVENTIVE MAINT THEN ECB BITE TEST NML PER AMM 49-61-34-400-801-A."
HL8027,330,2024-07-10 0:00:00,2024-07-10 7:25:00,"&lsquo;AFTER LANDING, APU AUTO SHUTDOWN DISPLAYED&lsquo; RELATED SYSTEM WIRING CHECK DUE",MAINT MSG: 494138. NOT CONFIRMED(ECB BITE TEST OK) IAW TSM TASK 49-00-00-810-881-A. APU IGN SYS WIRING CHK NML FROM APU ECB(59KD) TO IGN EXCITER(59KA10) PLUG(P10) PER AWM 49-15-01 AND THEN SYS OP&rsquo; CHK &amp; ECB BITE TEST NML PER AMM TASK 49-00-00-710-801-A &amp; 49-61-34-400-801-A
HL7540,330,2024-07-10 0:00:00,2024-07-12 2:21:43,[PREDICTIVE] APU OIL TEMPERATURE TOO HIGH,"NO MAINT MSG, ACCORDING TO MOT REQUEST ,REPLACED OIL- COOLER (PREDICTIVE MAINT) AND THEN APU OP' LEAK CHK NML PER AMM TASK 49-91-44-400-801-A"
HL7540,330,2024-07-10 0:00:00,2024-07-12 4:27:43,[PREDICTIVE] REPEATED APU IGNITION MESSAGE,"MAINT MSG NO 494138 , ACCORDING TO TSM 49-00-00-810-881-A, REPLACED IGN EXCITER,LEAD LINE,IGN PLUG AND THEN APU OP' TEST NML PER AMM TASK 49-41-38-400-801-A,49-41-43-400-801-A,49-41-41-400-801-A"
HL8227,330,2024-07-10 0:00:00,2024-07-12 14:22:31,APU AIR INTAKE DUCT LH FWD BONDING JUMPER 1EA WORN (IPC 49-16-46-01 ITEM 50),REPLACED SERVICEABLE JUMPER AT APU AIR INTAKE DUCT L/H FWD AREA(PME:MP00026569) PER AMM 20-28-00-02 CONF00
HL8027,330,2024-07-09 0:00:00,2024-07-09 16:46:05,AFTER LANDING APU FAULT AUTO SHUT DOWN DISPLAYED,"M.MSG:IGN PLUG/EXCITER. ACCORD' TO TSM 49-41-00-810-812-A, APU OP' TESTED NML PER AMM 49-00--710-801-A"
HL8027,330,2024-07-09 0:00:00,2024-07-09 23:59:48,APU AUTO SHUT DOWN DURING APU START WITH STS MSG &quot;APU&quot; &lt;IGNITION PLUG (59KA31)/ IGNITION EXCITER(59KA10)&gt;,"MAINT MSG NO 494138. ACCORDING TO TSM TASK 49-00-00-810-881-A, REPLACED BOTH IGNITER PLUGS &amp; IGNITION LEAD A ,B FOR PREVENTIVE MAINT AND THEN  OP TEST NML PER AMM TASK 49-41-41-400-801-A, 49-41-43-400-801-A"
HL8027,330,2024-07-09 0:00:00,2024-07-10 1:00:00,"AFTER LANDING, APU AUTO SHUTDOWN DISPLAYED","MAINT MSG 494138.IAW TSM TASK 49-41-00-810-881-A,REPLACED IGN EXCITER AND THEN  APU OP' &amp; BITE TEST NML PER AMM TASK  49-41-38-400-801-A"
HL7701,330,2024-07-08 0:00:00,2024-07-08 10:44:48,&quot;LOW OIL TEMP SNSR(59KT9)&quot; MSG MEMORIZED ON PFR,"MAINT' MSG: 499112(NOT CONFIRMED). ACCORDING TO TSM TASK49-00-00-810-801-A, APU BITE TEST NORMAL &amp; SYSTEM WIRING CHECKED NORMAL BETWEEN APU ECB AND APU OIL LOW TEMP' SNSR(59KT9) P9 PER AWM49-61-03 &amp; 49-15-01 AND THEN  SYSTEM CHECKED NORMAL PER AMM TASK49-00-00-740-801-A&lt;PME CONT' No.: MI00020378&gt;"
HL8027,330,2024-07-06 0:00:00,2024-07-07 4:11:57,AFTER LANDING DURING APU START APU AUTO SHUTDOWN 1 TIME,"MAINT MSG 494138 IAW TSM TASK 49-62-00-810-918-A, APU OP CHKED NML PER AMM TASK 49-00-00-710-801-A"
HL7709,330,2024-07-06 0:00:00,2024-07-06 1:00:00,"&quot;AFT LANDING, ECAM FUEL APU AFT PUMP FAULT DISPLAYED&quot; RELATED WIRING CHK DUE","MAINT MSG: 282212. NOT CONFIRMED. IAW TSM TASK 28-22-00-810-801-A, FROM APU ECB(59KD) TO LOW FUEL PRESSURE SWITCH(59KF17) WIRING CHK'D NML &amp; LOW FUEL PRESSURE-SWITCH(59KF17) P17 CONNECTOR AND WIRING HARNESS VISUAL INSP' NML PER WDM 49-15-01 &amp; 49-61-03."
HL7710,330,2024-07-05 0:00:00,2024-07-07 5:19:48,APU INOP,"MAINT MSG NO 499414, ACCORDING TO TSM 49-62-00-810-813-A, REPLACED APU OIL PUMP ASSY AND APU O'P CHECK NML PER AMM 49-91-45-400-801-A( OIL PUMP SHAFT STUCK)"
HL7709,330,2024-07-02 0:00:00,2024-07-02 14:20:01,"AFT LANDING, ECAM FUEL APU AFT PUMP FAULT DISPLAYED.","CMS HAS NO FAULTS FOR APU/FUEL SYS, FUEL PUMP OPES TESTED NORMAL PER AMM 28-21-00-700-801-A, ALSO APU OPS CHECKS NORMAL PER AMM 49-00-00-860-801-A01."
HL7701,330,2024-07-01 0:00:00,2024-07-01 5:05:47,APU DRAIN HOSE DAMAGED,REPLACED APU FUEL DRAIN HOSE PER AMM TASK 49-11-11-400-801-A
HL7701,330,2024-06-30 0:00:00,2024-07-01 1:00:00,APU P13(FSSV) WIRE HARNESS BACKSHELL DAMAGED.,RE-ASSEMBLY &amp; TIGHT BACKSHEEL OF FCU PLUG(59KF19 - P13) AND THEN APU STARTING CHK NML PER AMM 49-00-00-860-801-A01
HL8002,330,2024-06-28 0:00:00,2024-07-02 5:30:00,APU Oil Temperature too High (SPM Alert),"NO MAINT MSG, IAW TSM TASK 49-62-00-810-815-A, CHECK APU OIL LEVEL / APU COOLING FAN INLET &amp; OULET DUCT / OIL COOLER INLET DUCT / LUB &amp; GEN SCAVENGE OIL FILTER INSP NML AFTER THAT REPLACED WITH OIL COOLER AND THEN APU OPER &amp; LEAK CHK NML PER AMM TASK 49-91-44-400-801-A ( PME NO : MI00023739, MI00018809)"
HL7701,330,2024-06-26 0:00:00,2024-06-26 13:39:43,"AFTER ENG' SHUT DOWN, ECALM &quot;APU FAULT AUTO SHUT DOWN&quot; APPEAR.",APU MASTER SW RESET AND OP CHK'D OK PER AMM TASK 49-00-00-710-801-A
HL7701,330,2024-06-26 0:00:00,2024-06-27 4:54:11,[SER]HL7701 APU FCU CHANGE DUE,"NO MAINT MSG, ACCORDING TO MOT REQUEST, REPLACED APU FCU ASSY (SAVE APPLICATION) AND THEN APU OP' TEST &amp;  LEAK CHK NML PER AMM TASK 49-32-51-400-801-A"
HL8227,330,2024-06-25 0:00:00,2024-07-28 14:49:30,APU AUTO SHUTDOWN APU FAULT DISPLAYTED ON ECAM.,LOG/058866/AT 1.PERFORMED INSPECTION(CHECKED GOOD) &amp; APU OP'(HOT VALUE :118&#46020;) PER TSM TASK 49-62-00-810-815-A PARA 3-A-(1)~(5) &amp; (7)/2024.06.28/&#50628;&#54788;&#52384;2.PERFORMED LUB OIL FILTER &amp; SCAVENGE OIL FILTER DPI CHECK (RESULT:NORMAL) AND REPLACED OIL COOLER (ACP ON WO H38977169) PER TSM TASK 49-62-00-810-815-A/2024.07.10/&#44053;&#49888;&#54785;  3.APU OP' TEST &amp; LEAK CHECKED NORMAL PER AMM TASK 49-00-00-710-801-A
HL7701,330,2024-06-24 0:00:00,2024-06-24 14:46:30,APU AUTO SHUT DOWN AFTER ENGINES SHOUTDOWN,"NO MAINT MSG,AFTER RESETTING THE APU MASTER SW THEN THE OPERATIONAL CHECK WAS GOOD PER AMM TASK49-00-00-710-801-A"
HL7701,330,2024-06-23 0:00:00,2024-06-23 10:17:18,APU FAULT ECAM WAS DISPLAYED AFT SHUTDOWN THE ENGINES. APU AUTO SHUT DOWN,"NO MAINT MSG, APU MASTER S/W RESET AND APU RE-START SUCCESS PER AMM TASK 49-00-00-710-801-A"
HL7701,330,2024-06-22 0:00:00,2024-06-22 20:20:07,APU AUTO SHUTDOWN AFT ENG SHUTDOWN,NO MAINT MSG. ACCORDING TO TSM 49-62-00-810-836-A PERFORMED BLEEDING OF THE APU FUEL LINE THEN APU OP' TEST NORMAL PER AMM TASK 49-21-51-400-801A
HL7701,330,2024-06-20 0:00:00,2024-06-20 16:18:11,"DURING ENG SHUTDOWN, APU AUTO SHUTDOWN",APU MASTER SW RESET AND APU OP CHK'D OK PER AMM TASK 49-00-00-710-801-A
HL7701,330,2024-06-19 0:00:00,2024-06-19 5:20:40,SOMETIMES APU AUTO SHUTDOWN,"MAINT MSG OVERTEMP'- IGV ACTR(59KE21)/ECB(59KD) ACCORDING TO TSM TASK 49-62-00-810-818-A, PERFORMED PUSH/PULL TEST AND THEN NML PER AMM 49-23-51-710-801-A. REPLACED IGV ACT AND THEN LEAK CHECK NML PER AMM TASK 49-23-51-400-801-A"
HL7701,330,2024-06-18 0:00:00,2024-06-18 11:56:39,APU AUTO SHUTDOWN AFTER ENGINE SHUTDOWN,"NO MAINT MSG, APU MASTER SW RESET AND THEN APU RESTART SUCCESSFUL AS PER AMM 49-00-00-710-801-A"
HL7584,330,2024-06-16 0:00:00,2024-06-18 14:25:57,APU R/H FWD MOUNT FWD ROD ASSY LWR RODEND EXCESS PLAY.,"INSTALLED APU R/H FWD MOUNT FWD ROD ASSY PER AMM TASK 49-12-42-400-801-A/MP00024001,MP00026569"
HL7584,330,2024-06-10 0:00:00,2024-06-10 5:49:18,APU SURGE AIR DUCT CLAMP CRACK.,REPLACED CLAMP PER AMM TASK 49-51-52-400-801-A. (PME CONTROL : MI00011694)
HL8212,330,2024-06-09 0:00:00,2024-06-23 11:51:38,APU AIR INTAKE DUCT BOTH SIDE GUIDE VANE PIN BROKEN,1.REMOVED APU AIR INTAKE DUCT PER AMM TASK 49-16-46-000-801-A/2024.06.12/&#51312;&#48176;&#54620; 2. REPLACED APU INTAKE DUCT GUIDE VANE PER 49-16-46-440-001-A01/2024.06.22/&#51060;&#47749;&#49688; 3.INSTALLED APU AIR INTAKE DUCT PER AMM TASK49-16-46-400-801/PME:MP00025203
HL7701,330,2024-06-07 0:00:00,2024-06-07 17:03:25,APU AUTOMATICALLY SHUT DOWN WHEN NO.2 ENGINE SHUT DOWN,"MAINT MSG OVERTEMP - IGV ACTR (59KE21/ECB(59KD) IAW TSM 49-62-00-810-818-A, RECYLED APU CTL C/B AND THEN APU BITE &amp; OP CHECK NML PER AMM 49-00-00-740-801-A,49-00-00-710-801-A"
HL7584,330,2024-06-06 0:00:00,2024-06-06 5:46:42,APU SURGE CONTROL V/V FUEL DRAIN TUBE CUT,REPLACED APU SURGE CONTROL V/V FUEL DRAIN TUBE PER AMM TASK 49-51-52-400-801-A
HL7701,330,2024-06-04 0:00:00,2024-06-04 6:40:15,APU FUEL INLET FILTER IND' POP OUT,"REPLACED APU FUEL FILTER AND LEAKL CHK, DPI INDICATOR CHK NML PER AMM TASK 49-32-41-960-801-A"
HL7553,330,2024-06-03 0:00:00,2024-06-03 3:43:47,[39 SAVE] APU BLEED VALVE(59KH7) MEMORIZED ON PFR,"MAINT MSG: 495151( APU BLEED V/V ). IAW TSM TASK 49-62-00-810-841-A, REPLACED APU BLEED V/V AND OP' &amp; LEAK CHK NML PER AMM TASK 49-51-51-400-801-A."
HL7701,330,2024-06-03 0:00:00,2024-06-04 7:10:12,WIRING CHK DUE FOR &quot;OVERTEMPERATURE IGV ACTR(59KE21)/ECB(59KD)&quot; MSG MEMORIZED ON APU SHUTDOWN RPT,"MAINT MSG: 492351, NOT CONFIRMED. REF TO TSM 49-62-00-810-818-A, WIRING CHK NML FROM ECB(59KD) TO IGV ACT(59KE21) AWM 49-15-01 &amp; 49-61-03."
HL8228,330,2024-06-01 0:00:00,2024-06-01 12:30:05,APU FAULT AUTO SHUT DOWN AFTER L/D ALL 3 START ATTEMPT FAILED (3RD ATTEMP AT 1530Z),"MAINT MSG:282000,IAW TSM 49-62-00-810-838-A. APU FUEL LINE BLEEDING AND APU OP' TEST NML PER AMM 49-00-00-710-801-A,28-22-00-870-801-A"
HL8228,330,2024-06-01 0:00:00,2024-06-03 1:00:15,"APU FAULT, THREE TIMES APU START ATTEMPT","MAINT MSG NO:282000,ACCORDING TO TSM TASK 49-62-00-810-836A.NO FAULT FOUND MSG.REPLACED FUEL NOZZLE ASSY(MO REQUEST) AND THEN OPER' LEAK CHK'D NML PER AMM TASK 49-31-41-400-801A.(PME:MI00011693)"
HL7701,330,2024-06-01 0:00:00,2024-06-03 15:52:19,AFTER ENG SHUT OFF APU FAULT,"NO MAINT MSG. ACCORDING TO TSM TASK 49-62-00-810-818-A, APU OP TEST NML PER AMM TASK 49-00-00-710-801-A."
HL8025,330,2024-06-01 0:00:00,2024-06-25 0:00:00,DURING TAXI IN APU AUTOMATICALLY SHUT DOWN,"TSD FCN 072 CONFIRMED IGNITION UNIT SHOWS FAILURE, APPLIED TSM 49-00-00-810-881-A REV NO. 103, DATED 01 APR 2024.    REPLACED APU IGNITION LEAD ASSY 59KA33 AS PER KAL A330-300 AMM TASK 49-41-43-000-801-A AND AMM TASK 49-41-43-400-80-A. AMM REV.103 DATED 01APR24    PME USED: TORQUE WRENCH  PN:MIR250HD  SN:PMEID13388  DUE DATE:22NOV2024  TORQUE APPLIED:100 IN.LBS. "
HL7553,330,2024-05-31 0:00:00,2024-05-31 4:44:23,P12' APU BLEED V/V CONNECTOR BACKSHELL WAS LOOSED,NO MAINT MSG. REPLACED APU BLEED VALVE P12 CONNECTOR BACKSHELL AND APU BLEED VALVE TEST NML PER AMM 49-51-51-710-803-A ESPM 20-44-14
HL7551,330,2024-05-30 0:00:00,2024-05-30 17:00:00,APU T/S DUE,PERFORMED CONNECTION ON GPU &amp; ATTEMPTED APU START IS SUCCESSED AND APU OPERATION CHECKED NORMAL PER AMM TASK 49-00-00-860-801-A01
HL7553,330,2024-05-30 0:00:00,2024-05-31 4:44:46,WIRING CHK DUE FOR APU BLEED VALVE(59KH7) ON ACARS,"NO MAINT MSG. ACCORDING TO TSM TASK 49-62-00-810-841-A, WIRING CHK'D NML FROM APU BLEED VALVE (59KH7) TO ECB ( 59KD) PER AWM 49-15-01."
HL7584,330,2024-05-29 0:00:00,2024-05-31 0:59:48,"APU AUTO SHUT DOWN ,AFER RESET SECOND AUTO  SHUT DOWN","MAINT MSG NO 494141, ACCORDING TO TSM 49-62-00-810-838-A, REPLACED APU IGN LEAD AND PLUGS AND APU O'P TEST NML PER AMM 49-41-41-400-801-A, 49-41-43-400-801-A"
